{
  "id": "shelf",
  "view": { "w": 640, "h": 360 },
  "world": { "w": 1920 },
  "scale": { "num": 1, "den": 5 },
  "sim": {
    "zMin": 186,
    "zMax": 344,
    "xMin": 20,
    "xMax": 1900,
    "gravity": 900,
    "floorTop": 157
  },
  "art": {
    "palette": "snes16",
    "bands": [
      { "kind": "stone", "y": 0, "h": 157, "seed": 9, "rowH": 18, "colors": ["stoneLight", "stone", "stoneDark", "stoneLine"] },
      { "kind": "planks", "y": 157, "h": 203, "seed": 13, "rowH": 16, "rowGrow": 3, "colors": ["floorDeep", "floorLine", "floorGrain"] }
    ],
    "props": [
      { "kind": "door", "x": 285, "y": 34, "w": 70, "h": 123 },
      {
        "kind": "shelf",
        "x": 420,
        "y": 84,
        "w": 180,
        "blocks": [
          { "x": 436, "w": 22, "h": 30, "color": "mint" },
          { "x": 490, "w": 30, "h": 18, "color": "pink" },
          { "x": 556, "w": 24, "h": 26, "color": "sky" }
        ]
      },
      {
        "kind": "shelf",
        "x": 700,
        "y": 110,
        "w": 130,
        "blocks": [
          { "x": 716, "w": 20, "h": 20, "color": "yellow" },
          { "x": 776, "w": 34, "h": 14, "color": "green" }
        ]
      },
      { "kind": "door", "x": 925, "y": 34, "w": 70, "h": 123 },
      {
        "kind": "shelf",
        "x": 1080,
        "y": 70,
        "w": 220,
        "blocks": [
          { "x": 1096, "w": 24, "h": 28, "color": "blue" },
          { "x": 1160, "w": 18, "h": 34, "color": "pink" },
          { "x": 1220, "w": 30, "h": 22, "color": "mint" },
          { "x": 1270, "w": 16, "h": 16, "color": "yellow" }
        ]
      },
      {
        "kind": "shelf",
        "x": 1400,
        "y": 118,
        "w": 100,
        "blocks": [
          { "x": 1416, "w": 26, "h": 24, "color": "sky" },
          { "x": 1460, "w": 20, "h": 30, "color": "green" }
        ]
      },
      { "kind": "door", "x": 1565, "y": 34, "w": 70, "h": 123 },
      {
        "kind": "shelf",
        "x": 1700,
        "y": 92,
        "w": 150,
        "blocks": [
          { "x": 1720, "w": 24, "h": 26, "color": "pink" },
          { "x": 1780, "w": 30, "h": 20, "color": "blue" }
        ]
      }
    ]
  }
}
