{
  "id": "crypt",
  "view": { "w": 640, "h": 360 },
  "world": { "w": 1920 },
  "scale": { "num": 1, "den": 5 },
  "sim": {
    "zMin": 186,
    "zMax": 344,
    "xMin": -40,
    "xMax": 1960,
    "gravity": 900,
    "floorTop": 157
  },
  "art": {
    "palette": "snes16",
    "bands": [
      { "kind": "stone", "y": 0, "h": 157, "seed": 5, "rowH": 18, "colors": ["stoneLight", "stone", "stoneDark", "stoneLine"] },
      { "kind": "flagstones", "y": 157, "h": 203, "seed": 7, "rowH": 16, "rowGrow": 3, "colors": ["flag", "flagLine", "flagLight"] }
    ],
    "props": [
      { "kind": "door", "x": 525, "y": 34, "w": 70, "h": 123 },
      { "kind": "door", "x": 1165, "y": 34, "w": 70, "h": 123 }
    ]
  }
}
